{
  "$schema": "./manual-review-attestation.schema.v1.json",
  "schemaVersion": "1.0.0",
  "kind": "m0-manual-review-attestation",
  "gateId": "WAVE0-EVIDENCE-CONTRACT",
  "recordId": "m0-wave0-evidence-contract-v8",
  "reviewedAt": "2026-08-05T20:58:43+08:00",
  "reviewerRefs": [
    "codex-agent:/root"
  ],
  "repositoryState": "working_tree_hashes",
  "subjectArtifacts": [
    {
      "path": "docs/evidence/m0/evidence-index.schema.v1.json",
      "sha256": "f56b3de06f4509f6ef38573b786bc86f11afa5fbf12104204fac82fd8ab0b80e"
    },
    {
      "path": "docs/evidence/m0/evidence-index.schema.v2.json",
      "sha256": "9e2dc84b4c98022678a4da6af9f211b0ac8fe5dc706fb8d6430e835489d022ab"
    },
    {
      "path": "docs/evidence/m0/external-subject-manifest.schema.v1.json",
      "sha256": "702c20d917a7c52f0612d727931f454d3929c388f074d8bbfed841a4e0dc3e82"
    },
    {
      "path": "docs/evidence/m0/external-environment-profile.schema.v1.json",
      "sha256": "7ae8d89577907af1bbaa0e8c27632d1e196d339369d65c14525908504584300e"
    },
    {
      "path": "docs/evidence/m0/external-attestation.schema.v1.json",
      "sha256": "bb15a3659b4d2d5306e0933fc8a07b71b6c8250936f95aa4819a52c7f120ed3f"
    },
    {
      "path": "docs/evidence/m0/manual-review-attestation.schema.v1.json",
      "sha256": "8ced3f368804710bf089ec8de340ff41519b5c8d750fa926ff377f13c887fbb4"
    },
    {
      "path": "docs/evidence/m0/m0-exit-manifest.v1.json",
      "sha256": "cdf959c523c97c59ff5b7ea7dc7e851394231d2f9d30c42d65da55ae10650c0e"
    },
    {
      "path": "docs/evidence/m0/m0-external-subject-policies.v1.json",
      "sha256": "14f771af8e2f64ac0e6a1f6bb80cd9d2477ef9d2c1bee36e04be9ced458dbbdc"
    },
    {
      "path": "docs/evidence/m0/validate-evidence-index.mjs",
      "sha256": "4ed880bddf0ae11b1925fe398658bafff0ba0b013032e5d0d8dc292119f66b78"
    },
    {
      "path": "docs/evidence/m0/README.md",
      "sha256": "5f0801312b4bee72784ef9545dabaf31c9baf387d7023ab635a9327944233028"
    },
    {
      "path": "AGENTS.md",
      "sha256": "f0b2d991de4d3283fcf45d9c960c67fb9db8b078418bc97a7501259451d08890"
    },
    {
      "path": "docs/IMPLEMENTATION_PLAN.md",
      "sha256": "e4a3fa4564dc1f03a6fe7092ac4baedac946a63eb410687ca04c26b32f3dbf55"
    },
    {
      "path": "docs/ROADMAP.md",
      "sha256": "3f0232d6c3db5233310a1c8d51c2fc5b4641bdb3a0229b8341fec1b69816e97a"
    }
  ],
  "result": "passed",
  "assertions": {
    "reviewed": 13,
    "failed": 0,
    "unresolvedHighSeverity": 0
  },
  "notes": "M0-012 Windows StoryBlueprint 对象校验阶段实现与 65 项 Vitest 断言落地后，已按最终工作树重新核对证据索引 v2、append-only 链、激活与未激活 gate 边界、人工／外部凭证语义、AGENTS.md 命令矩阵及实施计划映射；实验 Schema、本地对象校验和 Windows 探针未被扩张为正式 Schema、完整 runner、Reader／迁移、产品应用构建、Ubuntu、GitHub Actions 或浏览器认证。"
}
