{
  "$schema": "./manual-review-attestation.schema.v1.json",
  "schemaVersion": "1.0.0",
  "kind": "m0-manual-review-attestation",
  "gateId": "WAVE0-TOOLCHAIN-BASELINE",
  "recordId": "m0-wave0-toolchain-and-infrastructure-baseline",
  "reviewedAt": "2026-08-04T21:34:33+08:00",
  "reviewerRefs": [
    "codex-agent:/root"
  ],
  "repositoryState": "working_tree_hashes",
  "subjectArtifacts": [
    {
      "path": "docs/engineering/m0-toolchain-baseline.md",
      "sha256": "7fb70be933aec9a61db3d953824d74c0371646ded56bf250a40eb59d59c46591"
    },
    {
      "path": "docs/research/m0-toolchain-and-infrastructure-baseline.md",
      "sha256": "58e9a500bcda69bf389c60cb66e82e2afcd1497efb1d3a457bd3504749591d08"
    }
  ],
  "result": "passed",
  "assertions": {
    "reviewed": 2,
    "failed": 0,
    "unresolvedHighSeverity": 0
  },
  "notes": "Wave 0 工具链、Schema、IaC 与社区对象存储候选基线及一手资料研究已按最终工作树复核。"
}
