{
  "$schema": "./manual-review-attestation.schema.v1.json",
  "schemaVersion": "1.0.0",
  "kind": "m0-manual-review-attestation",
  "gateId": "WAVE0-EVIDENCE-CONTRACT",
  "recordId": "m0-wave0-evidence-contract-v31",
  "reviewedAt": "2026-08-07T01:50:00+08:00",
  "reviewerRefs": [
    "codex-agent:E:\\DataPulse AI"
  ],
  "repositoryState": "working_tree_hashes",
  "subjectArtifacts": [
    {
      "path": "docs/evidence/m0/evidence-index.schema.v1.json",
      "sha256": "f56b3de06f4509f6ef38573b786bc86f11afa5fbf12104204fac82fd8ab0b80e"
    },
    {
      "path": "docs/evidence/m0/evidence-index.schema.v2.json",
      "sha256": "9e2dc84b4c98022678a4da6af9f211b0ac8fe5dc706fb8d6430e835489d022ab"
    },
    {
      "path": "docs/evidence/m0/external-subject-manifest.schema.v1.json",
      "sha256": "702c20d917a7c52f0612d727931f454d3929c388f074d8bbfed841a4e0dc3e82"
    },
    {
      "path": "docs/evidence/m0/external-environment-profile.schema.v1.json",
      "sha256": "7ae8d89577907af1bbaa0e8c27632d1e196d339369d65c14525908504584300e"
    },
    {
      "path": "docs/evidence/m0/external-attestation.schema.v1.json",
      "sha256": "bb15a3659b4d2d5306e0933fc8a07b71b6c8250936f95aa4819a52c7f120ed3f"
    },
    {
      "path": "docs/evidence/m0/manual-review-attestation.schema.v1.json",
      "sha256": "8ced3f368804710bf089ec8de340ff41519b5c8d750fa926ff377f13c887fbb4"
    },
    {
      "path": "docs/evidence/m0/m0-exit-manifest.v1.json",
      "sha256": "cdf959c523c97c59ff5b7ea7dc7e851394231d2f9d30c42d65da55ae10650c0e"
    },
    {
      "path": "docs/evidence/m0/m0-external-subject-policies.v1.json",
      "sha256": "14f771af8e2f64ac0e6a1f6bb80cd9d2477ef9d2c1bee36e04be9ced458dbbdc"
    },
    {
      "path": "docs/evidence/m0/validate-evidence-index.mjs",
      "sha256": "f1d4bbae64a646ac06ebffd229ab5cb28522e8c5717d9a7d2614eeeea658a1bf"
    },
    {
      "path": "docs/evidence/m0/README.md",
      "sha256": "3f7e2801c57bbf49a92d63768beba9f5d1cb538efe266200e960e7b705e6109b"
    },
    {
      "path": "AGENTS.md",
      "sha256": "6269f01cec22e52f7515f56c1056b3b7a2539067d55b2049f8037c03387e91e8"
    },
    {
      "path": "docs/IMPLEMENTATION_PLAN.md",
      "sha256": "f025bf694cf67a47804c175f6135031728c5574eca7ec200a029f685691c5118"
    },
    {
      "path": "docs/ROADMAP.md",
      "sha256": "3f0232d6c3db5233310a1c8d51c2fc5b4641bdb3a0229b8341fec1b69816e97a"
    }
  ],
  "result": "passed",
  "assertions": {
    "reviewed": 13,
    "failed": 0,
    "unresolvedHighSeverity": 0
  },
  "notes": "M0-029 导入准入资源估算阶段复核：import-engine 新增 memory/csv-shape/zip-archive/admission 四文件，冻结工作内存估算系数、CSV 表头排除口径（首行表头不计入数据行/单元格）、XLSX ZIP 中央目录检查与 IMPORT_ARCHIVE_INVALID 封闭错误；test:unit 15 files/325 tests、check:workspace 510/510、check:dependencies 2960/2960、check:fixtures 521/521+self-test 30/30。证据记录 m0-import-admission-estimates-v1 为 IMPORT-ADMISSION 第二个 in_progress/partially_evidenced 记录，AGENTS.md 同步。本凭证复核 13 个主题工件（证据 Schema、校验器、README、AGENTS.md、实施计划、路线图），result=passed、failed=0、unresolvedHighSeverity=0，按 append-only 链取代 v30。"
}
