{
  "$schema": "./manual-review-attestation.schema.v1.json",
  "schemaVersion": "1.0.0",
  "kind": "m0-manual-review-attestation",
  "gateId": "WAVE0-EVIDENCE-CONTRACT",
  "recordId": "m0-wave0-evidence-contract-v4",
  "reviewedAt": "2026-08-05T01:52:50+08:00",
  "reviewerRefs": [
    "codex-agent:/root"
  ],
  "repositoryState": "working_tree_hashes",
  "subjectArtifacts": [
    {
      "path": "docs/evidence/m0/evidence-index.schema.v1.json",
      "sha256": "f56b3de06f4509f6ef38573b786bc86f11afa5fbf12104204fac82fd8ab0b80e"
    },
    {
      "path": "docs/evidence/m0/external-subject-manifest.schema.v1.json",
      "sha256": "702c20d917a7c52f0612d727931f454d3929c388f074d8bbfed841a4e0dc3e82"
    },
    {
      "path": "docs/evidence/m0/external-environment-profile.schema.v1.json",
      "sha256": "7ae8d89577907af1bbaa0e8c27632d1e196d339369d65c14525908504584300e"
    },
    {
      "path": "docs/evidence/m0/external-attestation.schema.v1.json",
      "sha256": "bb15a3659b4d2d5306e0933fc8a07b71b6c8250936f95aa4819a52c7f120ed3f"
    },
    {
      "path": "docs/evidence/m0/manual-review-attestation.schema.v1.json",
      "sha256": "8ced3f368804710bf089ec8de340ff41519b5c8d750fa926ff377f13c887fbb4"
    },
    {
      "path": "docs/evidence/m0/m0-exit-manifest.v1.json",
      "sha256": "cdf959c523c97c59ff5b7ea7dc7e851394231d2f9d30c42d65da55ae10650c0e"
    },
    {
      "path": "docs/evidence/m0/m0-external-subject-policies.v1.json",
      "sha256": "14f771af8e2f64ac0e6a1f6bb80cd9d2477ef9d2c1bee36e04be9ced458dbbdc"
    },
    {
      "path": "docs/evidence/m0/validate-evidence-index.mjs",
      "sha256": "000c839fccd39cfdc3ea3e8280edadd6182f510f199020bdddb224c89235a0d9"
    },
    {
      "path": "docs/evidence/m0/README.md",
      "sha256": "3c1096cadf2f7db15cb755dd5be8cc75f6e93b4e4d00d1e7378ab3765d744a91"
    },
    {
      "path": "AGENTS.md",
      "sha256": "25803304a1a71b2be41e041a2e976b9f59ff50ae7634c6c8f9f43893207f03a3"
    },
    {
      "path": "docs/IMPLEMENTATION_PLAN.md",
      "sha256": "1f219c9dcbe160fbcae35850ae17be68335398cd2d060ec6c3ba6d85d1d280ae"
    },
    {
      "path": "docs/ROADMAP.md",
      "sha256": "3f0232d6c3db5233310a1c8d51c2fc5b4641bdb3a0229b8341fec1b69816e97a"
    }
  ],
  "result": "passed",
  "assertions": {
    "reviewed": 12,
    "failed": 0,
    "unresolvedHighSeverity": 0
  },
  "notes": "M0-007 新增 check:dependencies 真实根命令后，已重新核对 Wave 0 证据契约、冻结退出全集、append-only 记录、Windows 阶段证据、延期验证和 AGENTS.md 命令口径；未放宽 gate、freshness、CI 或 fail-closed 语义。"
}
